Control #,Rec #,Lang,Source Audio ISBN-13,Course,Unit Num,start,stop,QZ #,line #,Speaker,Cue,Transliteration,#of words,Q or S,Course Name (Source),Snippet name,Skills
1,1,MA,9781442316775,Mandarin 3,1,,,01Q,,N,Boston’s winter is very cold.,,,,Pimsleur Chinese (Mandarin) Level 3 MP3,9781442394896_Mandarin_Chinese_3_QM_001.mp3,19
2,2,MA,9781442316775,Mandarin 3,1,,,01R,,M,波士顿的冬天很冷。,bō shì dùn de dōng tiān hěn lěng.,8,S,Pimsleur Chinese (Mandarin) Level 3 MP3,9781442394896_Mandarin_Chinese_3_QM_002.mp3,19
3,3,MA,9781442316775,Mandarin 3,1,,,02Q,,N,"Besides, it sometimes snows.",,,,Pimsleur Chinese (Mandarin) Level 3 MP3,9781442394896_Mandarin_Chinese_3_QM_003.mp3,19
4,4,MA,9781442316775,Mandarin 3,1,,,02R,,M,而且有时候下雪。,ér qiě yǒu shí hòu xià xuě.,7,S,Pimsleur Chinese (Mandarin) Level 3 MP3,9781442394896_Mandarin_Chinese_3_QM_004.mp3,19
5,5,MA,9781442316775,Mandarin 3,1,,,03Q,,N,Have you been to Beijing?,,,,Pimsleur Chinese (Mandarin) Level 3 MP3,9781442394896_Mandarin_Chinese_3_QM_005.mp3,18
6,6,MA,9781442316775,Mandarin 3,1,,,03R,,F,您去过北京吗？,nín qù guò běi jīng ma?,6,Q,Pimsleur Chinese (Mandarin) Level 3 MP3,9781442394896_Mandarin_Chinese_3_QM_006.mp3,18
7,7,MA,9781442316775,Mandarin 3,1,,,04Q,,N,Did you go to Beijing?,,,,Pimsleur Chinese (Mandarin) Level 3 MP3,9781442394896_Mandarin_Chinese_3_QM_007.mp3,18
8,8,MA,9781442316775,Mandarin 3,1,,,04R,,F,您去北京了吗？,nín qù běi jīng le ma ?,7,Q,Pimsleur Chinese (Mandarin) Level 3 MP3,9781442394896_Mandarin_Chinese_3_QM_008.mp3,18
9,9,MA,9781442316775,Mandarin 3,1,,,05Q,,N,Do they often return to see you?,,,,Pimsleur Chinese (Mandarin) Level 3 MP3,9781442394896_Mandarin_Chinese_3_QM_009.mp3,"5,7"
10,10,MA,9781442316775,Mandarin 3,1,,,05R,,M,他们常常回来看您吗？,tā men cháng cháng huí lai kàn nín ma?,9,Q,Pimsleur Chinese (Mandarin) Level 3 MP3,9781442394896_Mandarin_Chinese_3_QM_010.mp3,"5,7"
11,11,MA,9781442316775,Mandarin 3,1,,,06Q,,N,"Yesterday, it snowed a lot.",,,,Pimsleur Chinese (Mandarin) Level 3 MP3,9781442394896_Mandarin_Chinese_3_QM_011.mp3,"17,19"
12,12,MA,9781442316775,Mandarin 3,1,,,06R,,F,昨天雪下得很大。,zuó tiān xuě xià de hěn dà.,7,S,Pimsleur Chinese (Mandarin) Level 3 MP3,9781442394896_Mandarin_Chinese_3_QM_012.mp3,"17,19"
13,13,MA,9781442316775,Mandarin 3,1,,,07Q,,N,What kind of place is Boston?,,,,Pimsleur Chinese (Mandarin) Level 3 MP3,9781442394896_Mandarin_Chinese_3_QM_013.mp3,18
14,14,MA,9781442316775,Mandarin 3,1,,,07R,,F,波士顿是一个什么样的地方？,bō shì dùn shì yí gè shén me yàng de dì fāng?,12,Q,Pimsleur Chinese (Mandarin) Level 3 MP3,9781442394896_Mandarin_Chinese_3_QM_014.mp3,18
15,15,MA,9781442316775,Mandarin 3,1,,,08Q,,N,Do your children work in Boston?,,,,Pimsleur Chinese (Mandarin) Level 3 MP3,9781442394896_Mandarin_Chinese_3_QM_015.mp3,"5,20"
16,16,MA,9781442316775,Mandarin 3,1,,,08R,,F,您的小孩儿在波士顿工作吗？,nín de xiǎo háir zài bō shì dùn gōng zuò ma?,11,Q,Pimsleur Chinese (Mandarin) Level 3 MP3,9781442394896_Mandarin_Chinese_3_QM_016.mp3,"5,20"
17,17,MA,9781442316775,Mandarin 3,1,,,09Q,,N,"Yes, I’ve been to Beijing.",,,,Pimsleur Chinese (Mandarin) Level 3 MP3,9781442394896_Mandarin_Chinese_3_QM_017.mp3,18
18,18,MA,9781442316775,Mandarin 3,1,,,09R,,M,去过，我去过北京。,"qù guo, wŏ qù guo běi jīng.",7,S,Pimsleur Chinese (Mandarin) Level 3 MP3,9781442394896_Mandarin_Chinese_3_QM_018.mp3,18
19,19,MA,9781442316775,Mandarin 3,1,,,10Q,,N,When did you go to Beijing?,,,,Pimsleur Chinese (Mandarin) Level 3 MP3,9781442394896_Mandarin_Chinese_3_QM_019.mp3,18
20,20,MA,9781442316775,Mandarin 3,1,,,10R,,F,您是什么时候去北京的？,nín shì shén me shí hou qù běi jīng de?,10,Q,Pimsleur Chinese (Mandarin) Level 3 MP3,9781442394896_Mandarin_Chinese_3_QM_020.mp3,18
21,21,MA,9781442316775,Mandarin 3,2,,,01Q,,N,Where are you from?,,,,Pimsleur Chinese (Mandarin) Level 3 MP3,9781442394896_Mandarin_Chinese_3_QM_021.mp3,"7,16"
22,22,MA,9781442316775,Mandarin 3,2,,,01R,,M,您是哪儿的人？,nín shì nǎr de rén?,5,Q,Pimsleur Chinese (Mandarin) Level 3 MP3,9781442394896_Mandarin_Chinese_3_QM_022.mp3,"7,16"
23,23,MA,9781442316775,Mandarin 3,2,,,02Q,,N,What work do you do?,,,,Pimsleur Chinese (Mandarin) Level 3 MP3,9781442394896_Mandarin_Chinese_3_QM_023.mp3,"7,20"
24,24,MA,9781442316775,Mandarin 3,2,,,02R,,F,您做什么工作？,nín zuò shén me gōng zuò?,6,Q,Pimsleur Chinese (Mandarin) Level 3 MP3,9781442394896_Mandarin_Chinese_3_QM_024.mp3,"7,20"
25,25,MA,9781442316775,Mandarin 3,2,,,03Q,,N,"Last year, I took a lot of photographs.",,,,Pimsleur Chinese (Mandarin) Level 3 MP3,9781442394896_Mandarin_Chinese_3_QM_025.mp3,1
26,26,MA,9781442316775,Mandarin 3,2,,,03R,,M,去年我拍了很多照片。,qù nián wǒ pāi le hěn duō zhào piàn.,9,S,Pimsleur Chinese (Mandarin) Level 3 MP3,9781442394896_Mandarin_Chinese_3_QM_026.mp3,1
27,27,MA,9781442316775,Mandarin 3,2,,,04Q,,N,I’m from Beijing.,,,,Pimsleur Chinese (Mandarin) Level 3 MP3,9781442394896_Mandarin_Chinese_3_QM_027.mp3,"9,18"
28,28,MA,9781442316775,Mandarin 3,2,,,04R,,F,我是北京人。,wǒ shì běi jīng rén.,5,S,Pimsleur Chinese (Mandarin) Level 3 MP3,9781442394896_Mandarin_Chinese_3_QM_028.mp3,"9,18"
29,29,MA,9781442316775,Mandarin 3,2,,,05Q,,N,I work in the International Department.,,,,Pimsleur Chinese (Mandarin) Level 3 MP3,9781442394896_Mandarin_Chinese_3_QM_029.mp3,20
30,30,MA,9781442316775,Mandarin 3,2,,,05R,,F,我在国际部工作。,wǒ zài guó jì bù gōng zuò.,7,S,Pimsleur Chinese (Mandarin) Level 3 MP3,9781442394896_Mandarin_Chinese_3_QM_030.mp3,20
31,31,MA,9781442316775,Mandarin 3,2,,,06Q,,N,Have you been to Beijing in the winter?,,,,Pimsleur Chinese (Mandarin) Level 3 MP3,9781442394896_Mandarin_Chinese_3_QM_031.mp3,"17,19"
32,32,MA,9781442316775,Mandarin 3,2,,,06R,,F,您冬天去过北京吗？,nín dōng tiān qù guo běi jīng ma?,8,Q,Pimsleur Chinese (Mandarin) Level 3 MP3,9781442394896_Mandarin_Chinese_3_QM_032.mp3,"17,19"
33,33,MA,9781442316775,Mandarin 3,2,,,07Q,,N,"Yes, I have been to Beijing in February.",,,,Pimsleur Chinese (Mandarin) Level 3 MP3,9781442394896_Mandarin_Chinese_3_QM_033.mp3,"17,18"
34,34,MA,9781442316775,Mandarin 3,2,,,07R,,M,去过，我二月去过北京。,"qù guo, wǒ èr yuè qù guo běi jīng.",9,S,Pimsleur Chinese (Mandarin) Level 3 MP3,9781442394896_Mandarin_Chinese_3_QM_034.mp3,"17,18"
35,35,MA,9781442316775,Mandarin 3,2,,,08Q,,N,I’m going to stay until next year.,,,,Pimsleur Chinese (Mandarin) Level 3 MP3,9781442394896_Mandarin_Chinese_3_QM_035.mp3,"17,18"
36,36,MA,9781442316775,Mandarin 3,2,,,08R,,M,我要待到明年。,wǒ yào dāi dào míng nián.,6,S,Pimsleur Chinese (Mandarin) Level 3 MP3,9781442394896_Mandarin_Chinese_3_QM_036.mp3,"17,18"
37,37,MA,9781442316775,Mandarin 3,2,,,09Q,,N,Winter in Beijing is very cold.,,,,Pimsleur Chinese (Mandarin) Level 3 MP3,9781442394896_Mandarin_Chinese_3_QM_037.mp3,"17,19"
38,38,MA,9781442316775,Mandarin 3,2,,,09R,,M,北京的冬天很冷。,běi jīng de dōng tiān hěn lěng.,7,S,Pimsleur Chinese (Mandarin) Level 3 MP3,9781442394896_Mandarin_Chinese_3_QM_038.mp3,"17,19"
39,39,MA,9781442316775,Mandarin 3,2,,,10Q,,N,But I like Beijing.,,,,Pimsleur Chinese (Mandarin) Level 3 MP3,9781442394896_Mandarin_Chinese_3_QM_039.mp3,"9,18"
40,40,MA,9781442316775,Mandarin 3,2,,,10R,,M,可是我喜欢北京。,kě shì wŏ xĭ huan běi jīng.,7,S,Pimsleur Chinese (Mandarin) Level 3 MP3,9781442394896_Mandarin_Chinese_3_QM_040.mp3,"9,18"
41,41,MA,9781442316775,Mandarin 3,3,,,01Q,,N,How long did you stay?,,,,Pimsleur Chinese (Mandarin) Level 3 MP3,9781442394896_Mandarin_Chinese_3_QM_041.mp3,18
42,42,MA,9781442316775,Mandarin 3,3,,,01R,,F,您待了多久？,nín dāi le duō jiǔ?,5,Q,Pimsleur Chinese (Mandarin) Level 3 MP3,9781442394896_Mandarin_Chinese_3_QM_042.mp3,18
43,43,MA,9781442316775,Mandarin 3,3,,,02Q,,N,Where did you learn Mandarin?,,,,Pimsleur Chinese (Mandarin) Level 3 MP3,9781442394896_Mandarin_Chinese_3_QM_043.mp3,15
44,44,MA,9781442316775,Mandarin 3,3,,,02R,,F,您是在哪儿学普通话的？,nín shì zài nǎr xué pǔ tōng huà de?,9,Q,Pimsleur Chinese (Mandarin) Level 3 MP3,9781442394896_Mandarin_Chinese_3_QM_044.mp3,15
45,45,MA,9781442316775,Mandarin 3,3,,,03Q,,N,I’m planning to go next year.,,,,Pimsleur Chinese (Mandarin) Level 3 MP3,9781442394896_Mandarin_Chinese_3_QM_045.mp3,"17,18"
46,46,MA,9781442316775,Mandarin 3,3,,,03R,,M,我打算明年去。,wǒ dǎ suàn míng nián qù.,6,S,Pimsleur Chinese (Mandarin) Level 3 MP3,9781442394896_Mandarin_Chinese_3_QM_046.mp3,"17,18"
47,47,MA,9781442316775,Mandarin 3,3,,,04Q,,N,When are you going to go?,,,,Pimsleur Chinese (Mandarin) Level 3 MP3,9781442394896_Mandarin_Chinese_3_QM_047.mp3,"17,18"
48,48,MA,9781442316775,Mandarin 3,3,,,04R,,F,您要什么时候去？,nín yào shén me shí hou qù?,7,Q,Pimsleur Chinese (Mandarin) Level 3 MP3,9781442394896_Mandarin_Chinese_3_QM_048.mp3,"17,18"
49,49,MA,9781442316775,Mandarin 3,3,,,05Q,,N,English is very easy.,,,,Pimsleur Chinese (Mandarin) Level 3 MP3,9781442394896_Mandarin_Chinese_3_QM_049.mp3,"9,15"
50,50,MA,9781442316775,Mandarin 3,3,,,05R,,M,英文很容易。,yīng wén hěn róng yì.,5,S,Pimsleur Chinese (Mandarin) Level 3 MP3,9781442394896_Mandarin_Chinese_3_QM_050.mp3,"9,15"
51,51,MA,9781442316775,Mandarin 3,3,,,06Q,,N,But Mandarin is very difficult.,,,,Pimsleur Chinese (Mandarin) Level 3 MP3,9781442394896_Mandarin_Chinese_3_QM_051.mp3,"9,15"
52,52,MA,9781442316775,Mandarin 3,3,,,06R,,M,可是普通话很难。,kě shì pǔ tōng huà hěn nán.,7,S,Pimsleur Chinese (Mandarin) Level 3 MP3,9781442394896_Mandarin_Chinese_3_QM_052.mp3,"9,15"
53,53,MA,9781442316775,Mandarin 3,3,,,07Q,,N,Not really. (polite response to a compliment),,,,Pimsleur Chinese (Mandarin) Level 3 MP3,9781442394896_Mandarin_Chinese_3_QM_053.mp3,"7,13,16"
54,54,MA,9781442316775,Mandarin 3,3,,,07R,,M,哪里哪里。,ná li ná li.,4,S,Pimsleur Chinese (Mandarin) Level 3 MP3,9781442394896_Mandarin_Chinese_3_QM_054.mp3,"7,13,16"
55,55,MA,9781442316775,Mandarin 3,3,,,08Q,,N,At an American school.,,,,Pimsleur Chinese (Mandarin) Level 3 MP3,9781442394896_Mandarin_Chinese_3_QM_055.mp3,9
56,56,MA,9781442316775,Mandarin 3,3,,,08R,,M,在美国的一所学校。,zài měi guó de yì suǒ xué xiào.,8,S,Pimsleur Chinese (Mandarin) Level 3 MP3,9781442394896_Mandarin_Chinese_3_QM_056.mp3,9
57,57,MA,9781442316775,Mandarin 3,3,,,09Q,,N,Is Mandarin difficult?,,,,Pimsleur Chinese (Mandarin) Level 3 MP3,9781442394896_Mandarin_Chinese_3_QM_057.mp3,15
58,58,MA,9781442316775,Mandarin 3,3,,,09R,,F,普通话难吗？,pŭ tōng huà nán ma?,5,Q,Pimsleur Chinese (Mandarin) Level 3 MP3,9781442394896_Mandarin_Chinese_3_QM_058.mp3,15
59,59,MA,9781442316775,Mandarin 3,3,,,10Q,,N,Where did you learn English?,,,,Pimsleur Chinese (Mandarin) Level 3 MP3,9781442394896_Mandarin_Chinese_3_QM_059.mp3,15
60,60,MA,9781442316775,Mandarin 3,3,,,10R,,M,您是在哪儿学英文的？,nín shì zài năr xué yīng wén de?,8,Q,Pimsleur Chinese (Mandarin) Level 3 MP3,9781442394896_Mandarin_Chinese_3_QM_060.mp3,15
61,61,MA,9781442316775,Mandarin 3,4,,,01Q,,N,When did you come to this restaurant?,,,,Pimsleur Chinese (Mandarin) Level 3 MP3,9781442394896_Mandarin_Chinese_3_QM_061.mp3,"6,17"
62,62,MA,9781442316775,Mandarin 3,4,,,01R,,F,您是什么时候来这家饭店的？,nín shì shén me shí hòu lái zhè jiā fàn diàn de?,12,Q,Pimsleur Chinese (Mandarin) Level 3 MP3,9781442394896_Mandarin_Chinese_3_QM_062.mp3,"6,17"
63,63,MA,9781442316775,Mandarin 3,4,,,02Q,,N,He can’t speak.,,,,Pimsleur Chinese (Mandarin) Level 3 MP3,9781442394896_Mandarin_Chinese_3_QM_063.mp3,15
64,64,MA,9781442316775,Mandarin 3,4,,,02R,,M,他不会说.,tā bú huì shuō.,4,S,Pimsleur Chinese (Mandarin) Level 3 MP3,9781442394896_Mandarin_Chinese_3_QM_064.mp3,15
65,65,MA,9781442316775,Mandarin 3,4,,,03Q,,N,He’s come to this restaurant.,,,,Pimsleur Chinese (Mandarin) Level 3 MP3,9781442394896_Mandarin_Chinese_3_QM_065.mp3,6
66,66,MA,9781442316775,Mandarin 3,4,,,03R,,M,他来过这家饭店。,tā lái guo zhè jiā fàn diàn.,7,S,Pimsleur Chinese (Mandarin) Level 3 MP3,9781442394896_Mandarin_Chinese_3_QM_066.mp3,6
67,67,MA,9781442316775,Mandarin 3,4,,,04Q,,N,I came to this restaurant with a friend.,,,,Pimsleur Chinese (Mandarin) Level 3 MP3,9781442394896_Mandarin_Chinese_3_QM_067.mp3,"5,6"
68,68,MA,9781442316775,Mandarin 3,4,,,04R,,M,我是跟一个朋友一起来这家饭店的。,wǒ shì gēn yí gè péng you yì qǐ lái zhè jiā fàn diàn de.,15,S,Pimsleur Chinese (Mandarin) Level 3 MP3,9781442394896_Mandarin_Chinese_3_QM_068.mp3,"5,6"
69,69,MA,9781442316775,Mandarin 3,4,,,05Q,,N,This restaurant’s food is very delicious.,,,,Pimsleur Chinese (Mandarin) Level 3 MP3,9781442394896_Mandarin_Chinese_3_QM_069.mp3,6
70,70,MA,9781442316775,Mandarin 3,4,,,05R,,M,这家饭店的饭很好吃。,zhè jiā fàn diàn de fàn hěn hǎo chī.,9,S,Pimsleur Chinese (Mandarin) Level 3 MP3,9781442394896_Mandarin_Chinese_3_QM_070.mp3,6
71,71,MA,9781442316775,Mandarin 3,4,,,06Q,,N,I went to college in America.,,,,Pimsleur Chinese (Mandarin) Level 3 MP3,9781442394896_Mandarin_Chinese_3_QM_071.mp3,9
72,72,MA,9781442316775,Mandarin 3,4,,,06R,,F,我是在美国上大学的。,wǒ shì zài měi guó shàng dà xué de.,9,S,Pimsleur Chinese (Mandarin) Level 3 MP3,9781442394896_Mandarin_Chinese_3_QM_072.mp3,9
73,73,MA,9781442316775,Mandarin 3,4,,,07Q,,N,I’m planning to learn at a Mandarin language school.,,,,Pimsleur Chinese (Mandarin) Level 3 MP3,9781442394896_Mandarin_Chinese_3_QM_073.mp3,15
74,74,MA,9781442316775,Mandarin 3,4,,,07R,,M,我打算在一所普通话学校学。,wǒ dǎ suàn zài yì suǒ pǔ tōng huà xué xiào xué.,12,S,Pimsleur Chinese (Mandarin) Level 3 MP3,9781442394896_Mandarin_Chinese_3_QM_074.mp3,15
75,75,MA,9781442316775,Mandarin 3,4,,,08Q,,N,"We have beer, wine, and white liquor.",,,,Pimsleur Chinese (Mandarin) Level 3 MP3,9781442394896_Mandarin_Chinese_3_QM_075.mp3,"6,17"
76,76,MA,9781442316775,Mandarin 3,4,,,08R,,M,我们有啤酒，葡萄酒，和白酒。,"wǒ mén yǒu pí jiǔ, pú tao jiǔ, hé bái jiǔ.",11,S,Pimsleur Chinese (Mandarin) Level 3 MP3,9781442394896_Mandarin_Chinese_3_QM_076.mp3,"6,17"
77,77,MA,9781442316775,Mandarin 3,4,,,09Q,,N,"Last January, I went to Boston.",,,,Pimsleur Chinese (Mandarin) Level 3 MP3,9781442394896_Mandarin_Chinese_3_QM_077.mp3,"17,18"
78,78,MA,9781442316775,Mandarin 3,4,,,09R,,M,去年一月我去波士顿了。,qù nián yī yuè wŏ qù bō shì dùn le.,10,S,Pimsleur Chinese (Mandarin) Level 3 MP3,9781442394896_Mandarin_Chinese_3_QM_078.mp3,"17,18"
79,79,MA,9781442316775,Mandarin 3,4,,,10Q,,N,I stayed there for three weeks.,,,,Pimsleur Chinese (Mandarin) Level 3 MP3,9781442394896_Mandarin_Chinese_3_QM_079.mp3,"12,17,18"
80,80,MA,9781442316775,Mandarin 3,4,,,10R,,M,我在那儿待了三个星期。,wŏ zài nàr dāi le sān gè xīng qī.,9,S,Pimsleur Chinese (Mandarin) Level 3 MP3,9781442394896_Mandarin_Chinese_3_QM_080.mp3,"12,17,18"
81,81,MA,9781442316775,Mandarin 3,5,,,01Q,,N,Which book are you looking for?,,,,Pimsleur Chinese (Mandarin) Level 3 MP3,9781442394896_Mandarin_Chinese_3_QM_081.mp3,1
82,82,MA,9781442316775,Mandarin 3,5,,,01R,,F,您在找哪一本书？,nín zài zhǎo nǎ yì běn shū?,7,Q,Pimsleur Chinese (Mandarin) Level 3 MP3,9781442394896_Mandarin_Chinese_3_QM_082.mp3,1
83,83,MA,9781442316775,Mandarin 3,5,,,02Q,,N,English is easier than Mandarin.,,,,Pimsleur Chinese (Mandarin) Level 3 MP3,9781442394896_Mandarin_Chinese_3_QM_083.mp3,15
84,84,MA,9781442316775,Mandarin 3,5,,,02R,,M,英文比普通话容易。,yīng wén bǐ pŭ tōng huà róng yì.,8,S,Pimsleur Chinese (Mandarin) Level 3 MP3,9781442394896_Mandarin_Chinese_3_QM_084.mp3,15
85,85,MA,9781442316775,Mandarin 3,5,,,03Q,,N,"Which is easier, English or Mandarin?",,,,Pimsleur Chinese (Mandarin) Level 3 MP3,9781442394896_Mandarin_Chinese_3_QM_085.mp3,15
86,86,MA,9781442316775,Mandarin 3,5,,,03R,,F,英文和普通话，哪一个容易？,"yīng wén hé pǔ tōng huà, nǎ yí gè róng yì?",11,Q,Pimsleur Chinese (Mandarin) Level 3 MP3,9781442394896_Mandarin_Chinese_3_QM_086.mp3,15
87,87,MA,9781442316775,Mandarin 3,5,,,04Q,,N,Is this also yours?,,,,Pimsleur Chinese (Mandarin) Level 3 MP3,9781442394896_Mandarin_Chinese_3_QM_087.mp3,7
88,88,MA,9781442316775,Mandarin 3,5,,,04R,,F,这也是您的吗？,zhè yě shì nín de ma?,6,Q,Pimsleur Chinese (Mandarin) Level 3 MP3,9781442394896_Mandarin_Chinese_3_QM_088.mp3,7
89,89,MA,9781442316775,Mandarin 3,5,,,05Q,,N,The book is on the table.,,,,Pimsleur Chinese (Mandarin) Level 3 MP3,9781442394896_Mandarin_Chinese_3_QM_089.mp3,7
90,90,MA,9781442316775,Mandarin 3,5,,,05R,,F,书在桌子上。,shū zài zhuō zi shàng.,5,S,Pimsleur Chinese (Mandarin) Level 3 MP3,9781442394896_Mandarin_Chinese_3_QM_090.mp3,7
91,91,MA,9781442316775,Mandarin 3,5,,,06Q,,N,Is the notebook also yours?,,,,Pimsleur Chinese (Mandarin) Level 3 MP3,9781442394896_Mandarin_Chinese_3_QM_091.mp3,7
92,92,MA,9781442316775,Mandarin 3,5,,,06R,,F,笔记本也是您的吗？,bǐ jì běn yě shì nín de ma?,8,Q,Pimsleur Chinese (Mandarin) Level 3 MP3,9781442394896_Mandarin_Chinese_3_QM_092.mp3,7
93,93,MA,9781442316775,Mandarin 3,5,,,07Q,,N,"Yes, this also is mine.",,,,Pimsleur Chinese (Mandarin) Level 3 MP3,9781442394896_Mandarin_Chinese_3_QM_093.mp3,"7,9"
94,94,MA,9781442316775,Mandarin 3,5,,,07R,,M,是，这也是我的。,"shì, zhè yě shì wǒ de.",6,S,Pimsleur Chinese (Mandarin) Level 3 MP3,9781442394896_Mandarin_Chinese_3_QM_094.mp3,"7,9"
95,95,MA,9781442316775,Mandarin 3,5,,,08Q,,N,I’d like to drink a little white liquor.,,,,Pimsleur Chinese (Mandarin) Level 3 MP3,9781442394896_Mandarin_Chinese_3_QM_095.mp3,"6,17"
96,96,MA,9781442316775,Mandarin 3,5,,,08R,,M,我想喝一点儿白酒。,wŏ xiăng hē yì diănr bái jĭu.,7,S,Pimsleur Chinese (Mandarin) Level 3 MP3,9781442394896_Mandarin_Chinese_3_QM_096.mp3,"6,17"
97,97,MA,9781442316775,Mandarin 3,5,,,09Q,,N,I’d like to order a cup of coffee.,,,,Pimsleur Chinese (Mandarin) Level 3 MP3,9781442394896_Mandarin_Chinese_3_QM_097.mp3,"6,16"
98,98,MA,9781442316775,Mandarin 3,5,,,09R,,M,我想要一杯咖啡。,wŏ xiăng yào yì bēi kā fēi.,7,S,Pimsleur Chinese (Mandarin) Level 3 MP3,9781442394896_Mandarin_Chinese_3_QM_098.mp3,"6,16"
99,99,MA,9781442316775,Mandarin 3,5,,,10Q,,N,What work does your friend do?,,,,Pimsleur Chinese (Mandarin) Level 3 MP3,9781442394896_Mandarin_Chinese_3_QM_099.mp3,"5,20"
100,100,MA,9781442316775,Mandarin 3,5,,,10R,,F,您的朋友做什么工作？,nín de péng you zuò shén me gōng zuò?,9,Q,Pimsleur Chinese (Mandarin) Level 3 MP3,9781442394896_Mandarin_Chinese_3_QM_100.mp3,"5,20"
101,101,MA,9781442316775,Mandarin 3,6,,,01Q,,N,Is there a good hotel in Nanjing?,,,,Pimsleur Chinese (Mandarin) Level 3 MP3,9781442394896_Mandarin_Chinese_3_QM_101.mp3,"16,18"
102,102,MA,9781442316775,Mandarin 3,6,,,01R,,M,南京有好的酒店吗？,nán jīng yǒu hǎo de jiǔ diàn ma?,8,Q,Pimsleur Chinese (Mandarin) Level 3 MP3,9781442394896_Mandarin_Chinese_3_QM_102.mp3,"16,18"
103,103,MA,9781442316775,Mandarin 3,6,,,02Q,,N,Did you make a hotel reservation?,,,,Pimsleur Chinese (Mandarin) Level 3 MP3,9781442394896_Mandarin_Chinese_3_QM_103.mp3,"16,18"
104,104,MA,9781442316775,Mandarin 3,6,,,02R,,F,您订酒店了吗？,nín dìng jiǔ diàn le ma?,6,Q,Pimsleur Chinese (Mandarin) Level 3 MP3,9781442394896_Mandarin_Chinese_3_QM_104.mp3,"16,18"
105,105,MA,9781442316775,Mandarin 3,6,,,03Q,,N,My friend ate Peking duck.,,,,Pimsleur Chinese (Mandarin) Level 3 MP3,9781442394896_Mandarin_Chinese_3_QM_105.mp3,"5,6"
106,106,MA,9781442316775,Mandarin 3,6,,,03R,,F,我的朋友吃北京烤鸭了。,wǒ de péng you chī běi jīng kǎo yā le.,10,S,Pimsleur Chinese (Mandarin) Level 3 MP3,9781442394896_Mandarin_Chinese_3_QM_106.mp3,"5,6"
107,107,MA,9781442316775,Mandarin 3,6,,,04Q,,N,I’m going to travel next month.,,,,Pimsleur Chinese (Mandarin) Level 3 MP3,9781442394896_Mandarin_Chinese_3_QM_107.mp3,"17,18"
108,108,MA,9781442316775,Mandarin 3,6,,,04R,,M,下个月我要旅行。,xià gè yuè wǒ yào lǚ xíng.,7,S,Pimsleur Chinese (Mandarin) Level 3 MP3,9781442394896_Mandarin_Chinese_3_QM_108.mp3,"17,18"
109,109,MA,9781442316775,Mandarin 3,6,,,05Q,,N,Where is today’s newspaper?,,,,Pimsleur Chinese (Mandarin) Level 3 MP3,9781442394896_Mandarin_Chinese_3_QM_109.mp3,"1,17"
110,110,MA,9781442316775,Mandarin 3,6,,,05R,,M,今天的报在哪儿？,jīn tiān de bāo zài nǎr?,6,Q,Pimsleur Chinese (Mandarin) Level 3 MP3,9781442394896_Mandarin_Chinese_3_QM_110.mp3,"1,17"
111,111,MA,9781442316775,Mandarin 3,6,,,06Q,,N,It’s an English book.,,,,Pimsleur Chinese (Mandarin) Level 3 MP3,9781442394896_Mandarin_Chinese_3_QM_111.mp3,1
112,112,MA,9781442316775,Mandarin 3,6,,,06R,,F,是一本英文书。,shì yì běn yīng wén shū.,6,S,Pimsleur Chinese (Mandarin) Level 3 MP3,9781442394896_Mandarin_Chinese_3_QM_112.mp3,1
113,113,MA,9781442316775,Mandarin 3,6,,,07Q,,N,I’ve had their green tea.,,,,Pimsleur Chinese (Mandarin) Level 3 MP3,9781442394896_Mandarin_Chinese_3_QM_113.mp3,"6,17"
114,114,MA,9781442316775,Mandarin 3,6,,,07R,,M,我喝过他们的绿茶。,wŏ hē guo tā men de lǜ chá.,8,S,Pimsleur Chinese (Mandarin) Level 3 MP3,9781442394896_Mandarin_Chinese_3_QM_114.mp3,"6,17"
115,115,MA,9781442316775,Mandarin 3,6,,,08Q,,N,She’s from Boston.,,,,Pimsleur Chinese (Mandarin) Level 3 MP3,9781442394896_Mandarin_Chinese_3_QM_115.mp3,9
116,116,MA,9781442316775,Mandarin 3,6,,,08R,,F,她是波士顿人。,tā shì bō shì dùn rén.,6,S,Pimsleur Chinese (Mandarin) Level 3 MP3,9781442394896_Mandarin_Chinese_3_QM_116.mp3,9
117,117,MA,9781442316775,Mandarin 3,6,,,09Q,,N,Can your friend speak Mandarin?,,,,Pimsleur Chinese (Mandarin) Level 3 MP3,9781442394896_Mandarin_Chinese_3_QM_117.mp3,"5,15"
118,118,MA,9781442316775,Mandarin 3,6,,,09R,,F,您的朋友会说普通话吗？,nín de péng you huì shuō pŭ tōng huà ma?,10,Q,Pimsleur Chinese (Mandarin) Level 3 MP3,9781442394896_Mandarin_Chinese_3_QM_118.mp3,"5,15"
119,119,MA,9781442316775,Mandarin 3,6,,,10Q,,N,She speaks well.,,,,Pimsleur Chinese (Mandarin) Level 3 MP3,9781442394896_Mandarin_Chinese_3_QM_119.mp3,15
120,120,MA,9781442316775,Mandarin 3,6,,,10R,,F,她说得很好。,tā shuō de hěn hăo.,5,S,Pimsleur Chinese (Mandarin) Level 3 MP3,9781442394896_Mandarin_Chinese_3_QM_120.mp3,15
121,121,MA,9781442316775,Mandarin 3,7,,,01Q,,N,Have you made a hotel reservation?,,,,Pimsleur Chinese (Mandarin) Level 3 MP3,9781442394896_Mandarin_Chinese_3_QM_121.mp3,"16,18"
122,122,MA,9781442316775,Mandarin 3,7,,,01R,,F,您订酒店了吗？,nín dìng jiǔ diàn le ma?,6,Q,Pimsleur Chinese (Mandarin) Level 3 MP3,9781442394896_Mandarin_Chinese_3_QM_122.mp3,"16,18"
123,123,MA,9781442316775,Mandarin 3,7,,,02Q,,N,Have you reserved seats?,,,,Pimsleur Chinese (Mandarin) Level 3 MP3,9781442394896_Mandarin_Chinese_3_QM_123.mp3,"1,16,18"
124,124,MA,9781442316775,Mandarin 3,7,,,02R,,F,您订座了吗？,nín dìng zuò le ma?,5,Q,Pimsleur Chinese (Mandarin) Level 3 MP3,9781442394896_Mandarin_Chinese_3_QM_124.mp3,"1,16,18"
125,125,MA,9781442316775,Mandarin 3,7,,,03Q,,N,My wife and I are planning to go on a trip.,,,,Pimsleur Chinese (Mandarin) Level 3 MP3,9781442394896_Mandarin_Chinese_3_QM_125.mp3,"5,18"
126,126,MA,9781442316775,Mandarin 3,7,,,03R,,M,我和我的太太打算去旅行。,wǒ hé wǒ de tài tai dǎ suàn qù lǚ xíng.,11,S,Pimsleur Chinese (Mandarin) Level 3 MP3,9781442394896_Mandarin_Chinese_3_QM_126.mp3,"5,18"
127,127,MA,9781442316775,Mandarin 3,7,,,04Q,,N,I haven’t yet reserved seats.,,,,Pimsleur Chinese (Mandarin) Level 3 MP3,9781442394896_Mandarin_Chinese_3_QM_127.mp3,"16,18"
128,128,MA,9781442316775,Mandarin 3,7,,,04R,,M,我还没有订座。,wǒ hái méi yǒu dìng zuò.,6,S,Pimsleur Chinese (Mandarin) Level 3 MP3,9781442394896_Mandarin_Chinese_3_QM_128.mp3,"16,18"
129,129,MA,9781442316775,Mandarin 3,7,,,05Q,,N,I’m going to stay at my friend’s place.,,,,Pimsleur Chinese (Mandarin) Level 3 MP3,9781442394896_Mandarin_Chinese_3_QM_129.mp3,"5,18"
130,130,MA,9781442316775,Mandarin 3,7,,,05R,,M,我要住在我的朋友那儿。,wǒ yào zhù zài wǒ de péng you nàr.,9,S,Pimsleur Chinese (Mandarin) Level 3 MP3,9781442394896_Mandarin_Chinese_3_QM_130.mp3,"5,18"
131,131,MA,9781442316775,Mandarin 3,7,,,06Q,,N,Where are you going to stay?,,,,Pimsleur Chinese (Mandarin) Level 3 MP3,9781442394896_Mandarin_Chinese_3_QM_131.mp3,18
132,132,MA,9781442316775,Mandarin 3,7,,,06R,,M,你们要住哪儿？,nĭ men yào zhù năr?,5,Q,Pimsleur Chinese (Mandarin) Level 3 MP3,9781442394896_Mandarin_Chinese_3_QM_132.mp3,18
133,133,MA,9781442316775,Mandarin 3,7,,,07Q,,N,We’re going to stay at the hotel.,,,,Pimsleur Chinese (Mandarin) Level 3 MP3,9781442394896_Mandarin_Chinese_3_QM_133.mp3,"16,18"
134,134,MA,9781442316775,Mandarin 3,7,,,07R,,M,我们要住在酒店。,wŏ men yào zhù zài jiŭ diàn.,7,S,Pimsleur Chinese (Mandarin) Level 3 MP3,9781442394896_Mandarin_Chinese_3_QM_134.mp3,"16,18"
135,135,MA,9781442316775,Mandarin 3,7,,,08Q,,N,I don’t want to stay at the hotel.,,,,Pimsleur Chinese (Mandarin) Level 3 MP3,9781442394896_Mandarin_Chinese_3_QM_135.mp3,"16,18"
136,136,MA,9781442316775,Mandarin 3,7,,,08R,,M,我不要住在酒店。,wŏ bú yào zhù zài jiŭ diàn.,7,S,Pimsleur Chinese (Mandarin) Level 3 MP3,9781442394896_Mandarin_Chinese_3_QM_136.mp3,"16,18"
137,137,MA,9781442316775,Mandarin 3,7,,,09Q,,N,How long are you going to stay?,,,,Pimsleur Chinese (Mandarin) Level 3 MP3,9781442394896_Mandarin_Chinese_3_QM_137.mp3,18
